{"$schema":"https://json-schema.org/draft/2020-12/schema","title":"Project Supernova Scheduled Assignment v2.3","type":"object","additionalProperties":false,"required":["task_network_plan_id","cohort_id","assignment_id","generation_seq","parent_state_git_identity","control_manifest_id","control_manifest_path","control_manifest_git_identity","network_checkpoint_id","runtime_state_id","network_mode","phase","short_test","benchmark_program","benchmark_suite_id","purpose","workers","sealed_slots"],"properties":{"task_network_plan_id":{"const":"61fbe7206e43ec538f310acf875e72865daf8fbb0e4ccbe27dcd6d1a072ff8a0"},"cohort_id":{"type":"string"},"assignment_id":{"type":"string"},"generation_seq":{"type":"integer","minimum":1},"parent_state_git_identity":{"type":"string","pattern":"^[0-9a-f]{40}$"},"control_manifest_id":{"type":"string"},"control_manifest_path":{"type":"string"},"control_manifest_git_identity":{"type":"string","pattern":"^[0-9a-f]{40}$"},"network_checkpoint_id":{"type":"string"},"runtime_state_id":{"type":"string"},"network_mode":{"enum":["GITHUB_BUS_CALIBRATION","DEGRADED_SAFE_REPLAY","FRESH_ENABLED","BENCHMARK_DISCOVERY_WAIT"]},"phase":{"type":"string"},"short_test":{"type":"boolean"},"benchmark_program":{"type":["string","null"]},"benchmark_suite_id":{"type":["string","null"]},"purpose":{"type":"string"},"workers":{"type":"object","additionalProperties":false,"required":["MF01","MF02","MF03","MF04","MF05","MM01","MM02","MM03","MM04","MM05","MM07","EXT01"],"properties":{"MF01":{"$ref":"#/$defs/worker"},"MF02":{"$ref":"#/$defs/worker"},"MF03":{"$ref":"#/$defs/worker"},"MF04":{"$ref":"#/$defs/worker"},"MF05":{"$ref":"#/$defs/worker"},"MM01":{"$ref":"#/$defs/worker"},"MM02":{"$ref":"#/$defs/worker"},"MM03":{"$ref":"#/$defs/worker"},"MM04":{"$ref":"#/$defs/worker"},"MM05":{"$ref":"#/$defs/worker"},"MM07":{"$ref":"#/$defs/worker"},"EXT01":{"$ref":"#/$defs/worker"}}},"sealed_slots":{"type":"array","items":{"type":"string"}}},"$defs":{"worker":{"type":"object","additionalProperties":false,"required":["fresh_allowed","role","goal","target_program","visibility_token","opaque_evidence_ids","private_manifest_id","private_manifest_git_identity","constraints"],"properties":{"fresh_allowed":{"type":"boolean"},"role":{"type":"string"},"goal":{"type":"string"},"target_program":{"enum":["MATH_FOUNDRY","MASTERMIND","JOINT"]},"visibility_token":{"type":"string"},"opaque_evidence_ids":{"type":"array","items":{"type":"string"}},"private_manifest_id":{"type":["string","null"]},"private_manifest_git_identity":{"type":["string","null"]},"constraints":{"type":"array","items":{"type":"string"}}}}}}
