{
  "task_network_plan_id": "61fbe7206e43ec538f310acf875e72865daf8fbb0e4ccbe27dcd6d1a072ff8a0",
  "cohort_id": "CAL-004-bcedd2a9",
  "assignment_id": "PS-GHBUS-CAL-004-bcedd2a9",
  "generation_seq": 4,
  "parent_state_git_identity": "bcedd2a95ecac89b0500eda916a0c0562f8dd0fc",
  "control_manifest_id": "CTRL-CAL-004-bcedd2a9-V23",
  "control_manifest_path": "control/CAL-004-bcedd2a9.json",
  "control_manifest_git_identity": "3b385351a8c504f51816dc0a0b4775fb0e405dfa",
  "network_checkpoint_id": "fb197b199f683471ec7266a450cd9b709218535a5ece7b3e234bcf45ff3dd59e",
  "runtime_state_id": "9d0a88cc9001295b5e4c0f4163e83c0fd64ce04521e34230ad3539af14f3dfaf",
  "network_mode": "GITHUB_BUS_CALIBRATION",
  "phase": "T0_SHORT_FULL_LOOP_TEST",
  "short_test": true,
  "benchmark_program": null,
  "benchmark_suite_id": null,
  "purpose": "Short full replay-only transport/control loop test. Keep work minimal: validate frozen control, assignment, authentication, standardized session/report creation and one role-specific plan-gating fact. No benchmark execution, protected evidence, broad prior search, or runtime modification.",
  "workers": {
    "MF01": {"fresh_allowed":false,"role":"Representation/blocker evidence","goal":"Prove MF01 can complete the standardized v2.3 transport/report contract and represent the current T0 blocker without scientific benchmark work.","target_program":"MATH_FOUNDRY","visibility_token":"957c5ea0216b0969f391ab6d21ed9048","opaque_evidence_ids":[],"private_manifest_id":null,"private_manifest_git_identity":null,"constraints":["short deterministic test","SAFE_REPLAY_ONLY","no benchmark execution","no deep research","no broad public-source sweep"]},
    "MF02": {"fresh_allowed":false,"role":"E1 route/schedule truth owner","goal":"Prove MF02 can complete the standardized v2.3 transport/report contract and confirm E1 is the next Foundry clean benchmark target without running it.","target_program":"MATH_FOUNDRY","visibility_token":"4afb0cd29069a25bb47a8608e7deabe3","opaque_evidence_ids":[],"private_manifest_id":null,"private_manifest_git_identity":null,"constraints":["short deterministic test","SAFE_REPLAY_ONLY","confirm BASE/SBS/VBS/AUTO/ORACLE_SCHEDULE contract only","no benchmark execution","no deep research"]},
    "MF03": {"fresh_allowed":false,"role":"Lemma/operator/intermediate-object invention","goal":"Prove MF03 can complete the standardized v2.3 transport/report contract and represent a candidate as external/not-promoted under T0.","target_program":"MATH_FOUNDRY","visibility_token":"72cd63cf72f59e4e071573713c0f5b3e","opaque_evidence_ids":[],"private_manifest_id":null,"private_manifest_git_identity":null,"constraints":["short deterministic test","SAFE_REPLAY_ONLY","no new mathematical claim required","no deep research"]},
    "MF04": {"fresh_allowed":false,"role":"Adversarial destruction/falsifier","goal":"Prove MF04 can complete the standardized v2.3 transport/report contract and run one cheap adversarial check of schema/auth/lineage without broad research.","target_program":"MATH_FOUNDRY","visibility_token":"f2f6bcce6ee92d9d4d42323e99e41883","opaque_evidence_ids":[],"private_manifest_id":null,"private_manifest_git_identity":null,"constraints":["short deterministic test","SAFE_REPLAY_ONLY","one cheap control-plane falsifier","no benchmark execution","no deep research"]},
    "MF05": {"fresh_allowed":false,"role":"C1 verified-product closure evidence/spec","goal":"Prove MF05 can complete the standardized v2.3 transport/report contract and confirm C1 remains gated until E1/justification/runtime support.","target_program":"MATH_FOUNDRY","visibility_token":"a0250c0d768690f10ed8022199436a5c","opaque_evidence_ids":[],"private_manifest_id":null,"private_manifest_git_identity":null,"constraints":["short deterministic test","SAFE_REPLAY_ONLY","no C1 score","no deep research"]},
    "MM01": {"fresh_allowed":false,"role":"React mechanism evidence","goal":"Prove MM01 can complete the standardized v2.3 transport/report contract with no protected React task consumption.","target_program":"MASTERMIND","visibility_token":"7a2981a0ac920cd13908f0a09c896fae","opaque_evidence_ids":[],"private_manifest_id":null,"private_manifest_git_identity":null,"constraints":["short deterministic test","SAFE_REPLAY_ONLY","no benchmark execution","no deep research"]},
    "MM02": {"fresh_allowed":false,"role":"DeepSWE mechanism evidence","goal":"Prove MM02 can complete the standardized v2.3 transport/report contract and preserve authority separation without benchmark execution.","target_program":"MASTERMIND","visibility_token":"f8f96378ca122e91077ebcc2613032cf","opaque_evidence_ids":[],"private_manifest_id":null,"private_manifest_git_identity":null,"constraints":["short deterministic test","SAFE_REPLAY_ONLY","no benchmark execution","no deep research"]},
    "MM03": {"fresh_allowed":false,"role":"SlopCode contract/mechanism evidence","goal":"Prove MM03 can complete the standardized v2.3 transport/report contract and represent typed missing/NOT_MEASURED correctly.","target_program":"MASTERMIND","visibility_token":"7663b26bac45388210340cb7c0b46ed9","opaque_evidence_ids":[],"private_manifest_id":null,"private_manifest_git_identity":null,"constraints":["short deterministic test","SAFE_REPLAY_ONLY","no benchmark execution","no deep research"]},
    "MM04": {"fresh_allowed":false,"role":"Senior SWE architecture/mechanism evidence","goal":"Prove MM04 can complete the standardized v2.3 transport/report contract and retain evaluator-execution validity as a gate, without benchmark execution.","target_program":"MASTERMIND","visibility_token":"995551dfa71e555389f6871659b78b4a","opaque_evidence_ids":[],"private_manifest_id":null,"private_manifest_git_identity":null,"constraints":["short deterministic test","SAFE_REPLAY_ONLY","no benchmark execution","no deep research"]},
    "MM05": {"fresh_allowed":false,"role":"E3 executable mechanism control","goal":"Prove MM05 can complete the standardized v2.3 transport/report contract and correctly report L/R/N as NOT_MEASURED without executable artifacts.","target_program":"MASTERMIND","visibility_token":"ebea9087260d6cafca2598211b653fc5","opaque_evidence_ids":[],"private_manifest_id":null,"private_manifest_git_identity":null,"constraints":["short deterministic test","SAFE_REPLAY_ONLY","L/R/N NOT_MEASURED","no deep research"]},
    "MM07": {"fresh_allowed":false,"role":"Before/after diagnostic and bounded self-proposal","goal":"Prove MM07 can complete the standardized v2.3 transport/report contract without running or promoting a before/after benchmark.","target_program":"MASTERMIND","visibility_token":"9eb14c336224f13804609d5d39e7a8ee","opaque_evidence_ids":[],"private_manifest_id":null,"private_manifest_git_identity":null,"constraints":["short deterministic test","SAFE_REPLAY_ONLY","no numeric before/after","no self-promotion","no deep research"]},
    "EXT01": {"fresh_allowed":false,"role":"Independent runtime/build + transport audit","goal":"Independently audit the short v2.3 loop's control freeze, public/private split, session standard, model-binding honesty and benchmark-successor registry without runtime modification.","target_program":"JOINT","visibility_token":"b8f47c5e5b00d89317b44cd3c6fb2c96","opaque_evidence_ids":[],"private_manifest_id":null,"private_manifest_git_identity":null,"constraints":["short deterministic test","SAFE_REPLAY_ONLY","no benchmark execution","no deep research"]}
  },
  "sealed_slots": ["SEALED_ORACLE_SLOT_A", "SEALED_ORACLE_SLOT_B"]
}
