{
  "task_network_plan_id":"61fbe7206e43ec538f310acf875e72865daf8fbb0e4ccbe27dcd6d1a072ff8a0",
  "cohort_id":"CAL-BR-007-2672995c",
  "assignment_id":"PS-BRANCH-CAL-BR-007-2672995c",
  "generation_seq":7,
  "parent_state_git_identity":"2672995c4ee9209bae72dbaedc72799d1ff78528",
  "control_manifest_id":"CTRL-CAL-BR-007-2672995c-V23-BR241",
  "control_manifest_path":"control/CAL-BR-007-2672995c.json",
  "control_manifest_git_identity":"27facdd14dfe7f1b41d9e8bafdec3f669aa484d4",
  "network_checkpoint_id":"fb197b199f683471ec7266a450cd9b709218535a5ece7b3e234bcf45ff3dd59e",
  "runtime_state_id":"9d0a88cc9001295b5e4c0f4163e83c0fd64ce04521e34230ad3539af14f3dfaf",
  "network_mode":"GITHUB_BUS_CALIBRATION",
  "phase":"T0_BRANCH_ISOLATED_FULL_LOOP_TEST",
  "short_test":true,
  "benchmark_program":null,
  "benchmark_suite_id":null,
  "purpose":"Clean countable replay-only branch GitOps full-loop test after diagnostics. Exact closed control schema, exact 21+6 frozen union, strict session header equality, 12 isolated workers, MM06 independent reread, MF06 integration, and one BIL00 CAS-protected consolidation PR. No fresh/protected benchmark evidence.",
  "workers":{
    "MF01":{"fresh_allowed":false,"role":"Representation/blocker evidence","goal":"Prove MF01 branch-isolated write and standardized report contract under the clean frozen generation.","target_program":"MATH_FOUNDRY","visibility_token":"96fc3bd7cdf59f72b134b45f56a3041e","opaque_evidence_ids":[],"private_manifest_id":null,"private_manifest_git_identity":null,"constraints":["worker branch only","exact assignment phase in session header","SAFE_REPLAY_ONLY","no benchmark execution","no deep research"]},
    "MF02":{"fresh_allowed":false,"role":"E1 route/schedule truth owner","goal":"Prove MF02 branch-isolated write and confirm E1 successor contract without executing it.","target_program":"MATH_FOUNDRY","visibility_token":"c52cdf216d527fd589047e5314004268","opaque_evidence_ids":[],"private_manifest_id":null,"private_manifest_git_identity":null,"constraints":["worker branch only","exact assignment phase in session header","SAFE_REPLAY_ONLY","no benchmark execution","no deep research"]},
    "MF03":{"fresh_allowed":false,"role":"Lemma/operator/intermediate-object invention","goal":"Prove MF03 branch-isolated write and external/not-promoted candidate semantics under the clean frozen generation.","target_program":"MATH_FOUNDRY","visibility_token":"e152436ad64495511f426ec655facb46","opaque_evidence_ids":[],"private_manifest_id":null,"private_manifest_git_identity":null,"constraints":["worker branch only","exact assignment phase in session header","SAFE_REPLAY_ONLY","no new math required","no deep research"]},
    "MF04":{"fresh_allowed":false,"role":"Adversarial destruction/falsifier","goal":"Attack the clean closed control schema, exact 21+6 union, immutable generation, HMAC, session identity and branch lineage.","target_program":"MATH_FOUNDRY","visibility_token":"9551b9994503083ba4ebd7315702a214","opaque_evidence_ids":[],"private_manifest_id":null,"private_manifest_git_identity":null,"constraints":["worker branch only","exact assignment phase in session header","SAFE_REPLAY_ONLY","no benchmark execution","no deep research"]},
    "MF05":{"fresh_allowed":false,"role":"C1 verified-product closure evidence/spec","goal":"Prove MF05 branch-isolated write and confirm C1 remains scientifically gated.","target_program":"MATH_FOUNDRY","visibility_token":"bf0f50788a666468e6ea73e8c646e2b5","opaque_evidence_ids":[],"private_manifest_id":null,"private_manifest_git_identity":null,"constraints":["worker branch only","exact assignment phase in session header","SAFE_REPLAY_ONLY","no C1 score","no deep research"]},
    "MM01":{"fresh_allowed":false,"role":"React mechanism evidence","goal":"Prove MM01 branch-isolated write without protected React evidence under the exact assignment phase.","target_program":"MASTERMIND","visibility_token":"a35ac9315bee85aca5f1f9d563b25531","opaque_evidence_ids":[],"private_manifest_id":null,"private_manifest_git_identity":null,"constraints":["worker branch only","exact assignment phase in session header","SAFE_REPLAY_ONLY","no benchmark execution","no deep research"]},
    "MM02":{"fresh_allowed":false,"role":"DeepSWE mechanism evidence","goal":"Prove MM02 branch-isolated write and authority separation under the exact assignment phase.","target_program":"MASTERMIND","visibility_token":"ac2be4d40d025b184dacfecd31763fbb","opaque_evidence_ids":[],"private_manifest_id":null,"private_manifest_git_identity":null,"constraints":["worker branch only","exact assignment phase in session header","SAFE_REPLAY_ONLY","no benchmark execution","no deep research"]},
    "MM03":{"fresh_allowed":false,"role":"SlopCode contract/mechanism evidence","goal":"Prove MM03 branch-isolated write and typed NOT_MEASURED semantics under the exact assignment phase.","target_program":"MASTERMIND","visibility_token":"ec962340fa39b396be6e870b67b4f792","opaque_evidence_ids":[],"private_manifest_id":null,"private_manifest_git_identity":null,"constraints":["worker branch only","exact assignment phase in session header","SAFE_REPLAY_ONLY","no benchmark execution","no deep research"]},
    "MM04":{"fresh_allowed":false,"role":"Senior SWE architecture/mechanism evidence","goal":"Prove MM04 branch-isolated write and evaluator-validity gate under the exact assignment phase.","target_program":"MASTERMIND","visibility_token":"88423413f26424efe33289c3c7051a0b","opaque_evidence_ids":[],"private_manifest_id":null,"private_manifest_git_identity":null,"constraints":["worker branch only","exact assignment phase in session header","SAFE_REPLAY_ONLY","no benchmark execution","no deep research"]},
    "MM05":{"fresh_allowed":false,"role":"E3 executable mechanism control","goal":"Prove MM05 branch-isolated write and L/R/N NOT_MEASURED without executable artifacts under the exact assignment phase.","target_program":"MASTERMIND","visibility_token":"c807b234c323281ee9912bba98381f44","opaque_evidence_ids":[],"private_manifest_id":null,"private_manifest_git_identity":null,"constraints":["worker branch only","exact assignment phase in session header","SAFE_REPLAY_ONLY","L/R/N NOT_MEASURED","no deep research"]},
    "MM07":{"fresh_allowed":false,"role":"Before/after diagnostic and bounded self-proposal","goal":"Prove MM07 branch-isolated write without numeric before/after or self-promotion under the exact assignment phase.","target_program":"MASTERMIND","visibility_token":"d8485c546efef707dd43660cb0c7c06c","opaque_evidence_ids":[],"private_manifest_id":null,"private_manifest_git_identity":null,"constraints":["worker branch only","exact assignment phase in session header","SAFE_REPLAY_ONLY","no numeric before/after","no deep research"]},
    "EXT01":{"fresh_allowed":false,"role":"Independent runtime/build + transport audit","goal":"Audit clean closed-schema branch isolation, exact 21+6 control union, session equality, HMAC/public-private split, model-binding honesty, benchmark succession and one-PR consolidation.","target_program":"JOINT","visibility_token":"07160bf68510d99d255a9b8a17dbf910","opaque_evidence_ids":[],"private_manifest_id":null,"private_manifest_git_identity":null,"constraints":["worker branch only","exact assignment phase in session header","SAFE_REPLAY_ONLY","no benchmark execution","no deep research"]}
  },
  "sealed_slots":["SEALED_ORACLE_SLOT_A","SEALED_ORACLE_SLOT_B"]
}
